{
  "protocol_version": "runtime-v4-expert-rest-action-v1",
  "schema_digest": "bb3555fae28eb1f79d08a15e9884696a579e4c20836f5016509f17e0f4c36fbd",
  "provenance": {
    "artifact": "sts2-protocol/runtime-v4-expert-rest-action",
    "source": "schemas/runtime-v4-expert-rest-action-v1.schema.json",
    "generator": "hand-authored"
  },
  "profile": "expert-rest-action",
  "correlation_id": "corr:rest:3",
  "instance_id": "instance:1",
  "session_id": "session:1",
  "lease_id": "lease:1",
  "lease_epoch": 4,
  "generation": 11,
  "state_id": "live:11",
  "operation_id": "rest-select:10:smith:card:bogus",
  "kind": "action_response",
  "action": {
    "action_id": "select_card:10:smith:card:bogus",
    "action": {
      "kind": "select_card",
      "selection_id": "selection:10:smith",
      "rest_option_id": "smith",
      "card_id": "card:bogus"
    }
  },
  "status": "settled",
  "observation": {
    "protocol_version": "runtime-v4-expert",
    "schema_digest": "0ee034d5da83f34e9fa0ba23038738d56ef8cfccb1c6e752af3ab63d212c8e42",
    "provenance": {
      "artifact": "sts2-protocol/runtime-v4-expert",
      "source": "schemas/runtime-v4-expert.schema.json",
      "generator": "hand-authored"
    },
    "profile": "expert-state",
    "state_id": "live:11",
    "generation": 11,
    "visible_seed": "synthetic-visible-seed",
    "run": {
      "character_id": "ironclad",
      "act": 1,
      "location": "rest:1"
    },
    "player": {
      "hp": 64,
      "max_hp": 80,
      "block": null,
      "energy": 0,
      "gold": 99,
      "hand": [],
      "deck": [
        {
          "card_id": "card:1",
          "name": "Strike",
          "cost": 1,
          "upgraded": false,
          "type": "attack",
          "rarity": "basic",
          "target": "any_enemy",
          "description": "Deal damage."
        },
        {
          "card_id": "card:2",
          "name": "Bash",
          "cost": 2,
          "upgraded": false,
          "type": "attack",
          "rarity": "basic",
          "target": "any_enemy",
          "description": "Deal damage and apply Vulnerable."
        }
      ],
      "discard": [],
      "exhaust": [],
      "powers": [],
      "statuses": [],
      "relics": [
        {
          "relic_id": "relic:burning-blood",
          "name": "Burning Blood"
        }
      ],
      "potions": [],
      "potion_slots": 0,
      "max_potion_slots": 3
    },
    "state": {
      "state": "selection",
      "choices": [
        {
          "choice_id": "card:1",
          "label": "Strike",
          "kind": "selection",
          "domain": null
        },
        {
          "choice_id": "card:2",
          "label": "Bash",
          "kind": "selection",
          "domain": null
        }
      ]
    },
    "legal_actions": [
      {
        "action_id": "select_card:11:card:2",
        "action": {
          "kind": "select_card",
          "selection_id": null,
          "card_id": "card:2"
        }
      },
      {
        "action_id": "confirm_selection:11",
        "action": {
          "kind": "confirm_selection",
          "selection_id": null
        }
      },
      {
        "action_id": "cancel_selection:11",
        "action": {
          "kind": "cancel_selection",
          "selection_id": null
        }
      }
    ]
  },
  "transition": {
    "kind": "rest_option_selection_progressed",
    "before_generation": 10,
    "after_generation": 11,
    "rest_option_id": "smith",
    "selection_id": "selection:10:smith",
    "selection_kind": "card",
    "required_count": 2,
    "selected_choice_ids": [
      "card:bogus"
    ],
    "remaining_count": 1,
    "selector": {
      "selection_id": "selection:10:smith",
      "selection_kind": "card",
      "required_count": 2,
      "selected_choice_ids": [
        "card:bogus"
      ],
      "remaining_count": 1,
      "legal_actions": [
        {
          "action_id": "select_card:11:smith:card:bogus",
          "action": {
            "kind": "select_card",
            "selection_id": "selection:10:smith",
            "rest_option_id": "smith",
            "card_id": "card:bogus"
          }
        },
        {
          "action_id": "cancel_selection:11:smith",
          "action": {
            "kind": "cancel_selection",
            "selection_id": "selection:10:smith",
            "rest_option_id": "smith"
          }
        }
      ]
    },
    "effect_witness": null
  },
  "effect_witness": null,
  "error_code": null
}
