{
  "protocol_version": "runtime-v4-expert-rest-action-v1",
  "schema_digest": "bb3555fae28eb1f79d08a15e9884696a579e4c20836f5016509f17e0f4c36fbd",
  "provenance": {
    "artifact": "sts2-protocol/runtime-v4-expert-rest-action",
    "source": "schemas/runtime-v4-expert-rest-action-v1.schema.json",
    "generator": "hand-authored"
  },
  "profile": "expert-rest-action",
  "correlation_id": "corr:rest:6",
  "instance_id": "instance:1",
  "session_id": "session:1",
  "lease_id": "lease:1",
  "lease_epoch": 4,
  "generation": 13,
  "state_id": "live:13",
  "operation_id": "rest-select:12:smith:confirm",
  "kind": "action_response",
  "action": {
    "action_id": "confirm_selection:12:smith",
    "action": {
      "kind": "confirm_selection",
      "selection_id": "selection:10:smith",
      "rest_option_id": "smith"
    }
  },
  "status": "settled",
  "observation": {
    "protocol_version": "runtime-v4-expert",
    "schema_digest": "0ee034d5da83f34e9fa0ba23038738d56ef8cfccb1c6e752af3ab63d212c8e42",
    "provenance": {
      "artifact": "sts2-protocol/runtime-v4-expert",
      "source": "schemas/runtime-v4-expert.schema.json",
      "generator": "hand-authored"
    },
    "profile": "expert-state",
    "state_id": "live:13",
    "generation": 13,
    "visible_seed": "synthetic-visible-seed",
    "run": {
      "character_id": "ironclad",
      "act": 1,
      "location": "rest:1"
    },
    "player": {
      "hp": 64,
      "max_hp": 80,
      "block": null,
      "energy": 0,
      "gold": 99,
      "hand": [],
      "deck": [
        {
          "card_id": "card:1",
          "name": "Strike+",
          "cost": 1,
          "upgraded": true,
          "type": "attack",
          "rarity": "basic",
          "target": "any_enemy",
          "description": "Deal damage."
        },
        {
          "card_id": "card:2",
          "name": "Bash+",
          "cost": 2,
          "upgraded": true,
          "type": "attack",
          "rarity": "basic",
          "target": "any_enemy",
          "description": "Deal damage and apply Vulnerable."
        }
      ],
      "discard": [],
      "exhaust": [],
      "powers": [],
      "statuses": [],
      "relics": [
        {
          "relic_id": "relic:burning-blood",
          "name": "Burning Blood"
        }
      ],
      "potions": [],
      "potion_slots": 0,
      "max_potion_slots": 3
    },
    "state": {
      "state": "rest",
      "choices": [
        {
          "choice_id": "rest:proceed",
          "label": "Proceed",
          "kind": "rest",
          "domain": null
        }
      ]
    },
    "legal_actions": [
      {
        "action_id": "proceed:13",
        "action": {
          "kind": "proceed"
        }
      }
    ]
  },
  "transition": {
    "kind": "rest_option_selection_completed",
    "before_generation": 12,
    "after_generation": 13,
    "rest_option_id": "smith",
    "selection_id": "selection:10:smith",
    "selection_kind": "player",
    "required_count": 2,
    "selected_choice_ids": [
      "card:1",
      "card:2"
    ],
    "remaining_count": 0,
    "completed": true,
    "effect_witness": {
      "version": "rest-effect-witness-v1",
      "kind": "smith_applied",
      "operation_id": "rest-select:12:smith:confirm",
      "rest_option_id": "smith",
      "generation": 13,
      "evidence": {
        "kind": "card_change",
        "added_card_ids": [],
        "removed_card_ids": [],
        "upgraded_card_ids": [
          "card:1",
          "card:2"
        ]
      }
    }
  },
  "effect_witness": {
    "version": "rest-effect-witness-v1",
    "kind": "smith_applied",
    "operation_id": "rest-select:12:smith:confirm",
    "rest_option_id": "smith",
    "generation": 13,
    "evidence": {
      "kind": "card_change",
      "added_card_ids": [],
      "removed_card_ids": [],
      "upgraded_card_ids": [
        "card:1",
        "card:2"
      ]
    }
  },
  "error_code": null
}
