{
  "protocol_version": "runtime-v4-expert-rest-action-v1",
  "schema_digest": "bb3555fae28eb1f79d08a15e9884696a579e4c20836f5016509f17e0f4c36fbd",
  "provenance": {
    "artifact": "sts2-protocol/runtime-v4-expert-rest-action",
    "source": "schemas/runtime-v4-expert-rest-action-v1.schema.json",
    "generator": "hand-authored"
  },
  "profile": "expert-rest-action",
  "correlation_id": "corr:rest:6",
  "instance_id": "instance:1",
  "session_id": "session:1",
  "lease_id": "lease:1",
  "lease_epoch": 4,
  "generation": 22,
  "state_id": "live:22",
  "operation_id": "rest-select:21:mend:confirm",
  "kind": "action_response",
  "action": {
    "action_id": "confirm-selection:21:mend",
    "action": {
      "kind": "confirm_selection",
      "selection_id": "selection:20:mend",
      "rest_option_id": "mend"
    }
  },
  "status": "settled",
  "observation": {
    "protocol_version": "runtime-v4-expert",
    "schema_digest": "0ee034d5da83f34e9fa0ba23038738d56ef8cfccb1c6e752af3ab63d212c8e42",
    "provenance": {
      "artifact": "sts2-protocol/runtime-v4-expert",
      "source": "schemas/runtime-v4-expert.schema.json",
      "generator": "hand-authored"
    },
    "profile": "expert-state",
    "state_id": "live:22",
    "generation": 22,
    "visible_seed": "synthetic-visible-seed",
    "run": {
      "character_id": "ironclad",
      "act": 1,
      "location": "rest:1"
    },
    "player": {
      "hp": 50,
      "max_hp": 80,
      "block": null,
      "energy": 0,
      "gold": 99,
      "hand": [],
      "deck": [],
      "discard": [],
      "exhaust": [],
      "powers": [],
      "statuses": [],
      "relics": [
        {
          "relic_id": "relic:burning-blood",
          "name": "Burning Blood"
        }
      ],
      "potions": [],
      "potion_slots": 0,
      "max_potion_slots": 3
    },
    "state": {
      "state": "rest",
      "choices": [
        {
          "choice_id": "rest:proceed",
          "label": "Proceed",
          "kind": "rest",
          "domain": null
        }
      ]
    },
    "legal_actions": [
      {
        "action_id": "proceed:22",
        "action": {
          "kind": "proceed"
        }
      }
    ]
  },
  "transition": {
    "kind": "rest_option_selection_completed",
    "before_generation": 21,
    "after_generation": 22,
    "rest_option_id": "mend",
    "selection_id": "selection:20:mend",
    "selection_kind": "player",
    "required_count": 1,
    "selected_choice_ids": [
      "player:bogus"
    ],
    "remaining_count": 0,
    "completed": true,
    "effect_witness": {
      "version": "rest-effect-witness-v1",
      "kind": "mend_applied",
      "operation_id": "rest-select:21:mend:confirm",
      "rest_option_id": "mend",
      "generation": 22,
      "target_player_id": "player:bogus",
      "evidence": {
        "kind": "hp_change",
        "hp_before": 40,
        "hp_after": 50,
        "max_hp_before": 80,
        "max_hp_after": 80
      }
    }
  },
  "effect_witness": {
    "version": "rest-effect-witness-v1",
    "kind": "mend_applied",
    "operation_id": "rest-select:21:mend:confirm",
    "rest_option_id": "mend",
    "generation": 22,
    "target_player_id": "player:bogus",
    "evidence": {
      "kind": "hp_change",
      "hp_before": 40,
      "hp_after": 50,
      "max_hp_before": 80,
      "max_hp_after": 80
    }
  },
  "error_code": null
}
