{
  "protocol_version": "runtime-v4-expert-rest-action-v1",
  "schema_digest": "bb3555fae28eb1f79d08a15e9884696a579e4c20836f5016509f17e0f4c36fbd",
  "provenance": { "artifact": "sts2-protocol/runtime-v4-expert-rest-action", "source": "schemas/runtime-v4-expert-rest-action-v1.schema.json", "generator": "hand-authored" },
  "profile": "expert-rest-action",
  "correlation_id": "corr:rest:5", "instance_id": "instance:1", "session_id": "session:1", "lease_id": "lease:1", "lease_epoch": 4,
  "generation": 20, "state_id": "live:20", "operation_id": "rest-op:19:mend", "kind": "action_response",
  "action": { "action_id": "rest-option:19:mend", "action": { "kind": "rest_option", "rest_option_id": "mend" } },
  "status": "settled",
  "observation": {
    "protocol_version": "runtime-v4-expert", "schema_digest": "0ee034d5da83f34e9fa0ba23038738d56ef8cfccb1c6e752af3ab63d212c8e42",
    "provenance": { "artifact": "sts2-protocol/runtime-v4-expert", "source": "schemas/runtime-v4-expert.schema.json", "generator": "hand-authored" },
    "profile": "expert-state", "state_id": "live:20", "generation": 20, "visible_seed": "synthetic-visible-seed",
    "run": { "character_id": "ironclad", "act": 1, "location": "rest:1" },
    "player": { "hp": 40, "max_hp": 80, "block": null, "energy": 0, "gold": 99, "hand": [], "deck": [], "discard": [], "exhaust": [], "powers": [], "statuses": [], "relics": [{ "relic_id": "relic:burning-blood", "name": "Burning Blood" }], "potions": [], "potion_slots": 0, "max_potion_slots": 3 },
    "state": { "state": "selection", "choices": [{ "choice_id": "player:local", "label": "Ironclad", "kind": "selection", "domain": null }] },
    "legal_actions": [{ "action_id": "cancel_selection:20", "action": { "kind": "cancel_selection", "selection_id": null } }]
  },
  "transition": {
    "kind": "rest_option_selection_requested", "before_generation": 19, "after_generation": 20, "rest_option_id": "mend",
    "selector": {
      "selection_id": "selection:20:mend", "selection_kind": "player", "required_count": 1, "selected_choice_ids": [], "remaining_count": 1,
      "legal_actions": [
        { "action_id": "select_player:20:mend:player:local", "action": { "kind": "select_player", "selection_id": "selection:20:mend", "rest_option_id": "mend", "player_id": "player:local" } },
        { "action_id": "cancel_selection:20:mend", "action": { "kind": "cancel_selection", "selection_id": "selection:20:mend", "rest_option_id": "mend" } }
      ]
    },
    "effect_witness": null
  },
  "effect_witness": null,
  "error_code": null
}
